{"$schema":"https://json-schema.org/draft/2020-12/schema","title":"Operation","type":"object","required":["schema_version","operation_id","correlation_id","kind","target","status","requested_at_utc","updated_at_utc","params"],"properties":{"schema_version":{"const":"1.0"},"operation_id":{"type":"string","minLength":1},"correlation_id":{"type":"string","minLength":1},"kind":{"type":"string","minLength":1},"target":{"type":"object","required":["kind","id"],"properties":{"kind":{"type":"string","minLength":1},"id":{"type":"string","minLength":1}},"additionalProperties":true},"status":{"enum":["received","authorized","queued","sent","confirmed","terminated","rejected"]},"status_reason":{"type":"string"},"requested_at_utc":{"type":"string","format":"date-time"},"updated_at_utc":{"type":"string","format":"date-time"},"params":{"type":"object"},"error":{"type":"object","required":["code","message"],"properties":{"code":{"type":"string","minLength":1},"message":{"type":"string","minLength":1}},"additionalProperties":true},"result":{"description":"I02: real evidence this Operation was actually confirmed, distinct from the declared capability that accepted it in the first place - run_id/observers_enabled let a consumer refuse to conclude success from a stale/replayed result or from a run with observation disabled, per this SDK's own concludes_success().","type":"object","required":["run_id","origin","observers_enabled","outcome"],"properties":{"run_id":{"type":"string","minLength":1},"revision":{"type":"string"},"origin":{"enum":["real","simulated"]},"observers_enabled":{"type":"boolean"},"accepted_at_utc":{"type":"string","format":"date-time"},"executed_at_utc":{"type":"string","format":"date-time"},"observed_at_utc":{"type":"string","format":"date-time"},"outcome":{"enum":["success","failure","unknown"]},"outcome_reason":{"type":"string"}},"if":{"properties":{"outcome":{"const":"success"}}},"then":{},"else":{"properties":{"outcome_reason":{"type":"string","minLength":1}},"required":["outcome_reason"]},"additionalProperties":true}},"additionalProperties":true}
