{
  "schema_version": "1.0",
  "operation_id": "op-3f9c2b1a",
  "correlation_id": "mission-77-leg-2",
  "kind": "move_to_pose",
  "target": {
    "kind": "robot",
    "id": "controller-1:robot-3"
  },
  "status": "terminated",
  "status_reason": "confirmed complete by a real, active observer",
  "requested_at_utc": "2024-01-01T00:00:00Z",
  "updated_at_utc": "2024-01-01T00:00:04Z",
  "params": {
    "pose": {"x": 120.5, "y": 40.0, "z": 15.0},
    "speed": 0.6
  },
  "result": {
    "run_id": "run-2024-01-01-0001",
    "revision": "config-rev-7",
    "origin": "real",
    "observers_enabled": true,
    "accepted_at_utc": "2024-01-01T00:00:01Z",
    "executed_at_utc": "2024-01-01T00:00:03Z",
    "observed_at_utc": "2024-01-01T00:00:04Z",
    "outcome": "success"
  }
}
